{
  "$schema": "schemas/catalogue-index-v1.schema.json",
  "contract": "ProgrammeCatalogueIndex",
  "version": 1,
  "language": "en",
  "verification_scope": "programme_identity_only",
  "identity_status": "official_source_listed",
  "requirements_status": "not_collected",
  "updated_at": "2026-06-26",
  "programme_count": 13986,
  "programme_id_sha256": "a8791168c769d29740e6b305b09fb5a29039cc1654c569beca71da7ff4e4901d",
  "institutions": [
    {
      "id": "oxford",
      "name": "University of Oxford",
      "short_name": "Oxford",
      "group": "UK Core",
      "region": "United Kingdom",
      "accessed_at": "2026-06-26",
      "identity_status": "official_source_listed",
      "requirements_status": "not_collected",
      "programme_count": 459,
      "undergraduate_count": 52,
      "postgraduate_count": 407,
      "programme_id_sha256": "e283cf0607445e100bd1bffab47859db588f0bb3d30620d754667c6e6a911e56",
      "source_file": "institutions/oxford.json",
      "migration_source": "oxfordPrograms.ts"
    },
    {
      "id": "cambridge",
      "name": "University of Cambridge",
      "short_name": "Cambridge",
      "group": "UK Core",
      "region": "United Kingdom",
      "accessed_at": "2026-06-26",
      "identity_status": "official_source_listed",
      "requirements_status": "not_collected",
      "programme_count": 392,
      "undergraduate_count": 33,
      "postgraduate_count": 359,
      "programme_id_sha256": "0d0875747c38fe779ea9e69a1164b0e17b3608aa26eb2adcff010aec7577176b",
      "source_file": "institutions/cambridge.json",
      "migration_source": "cambridgePrograms.ts"
    },
    {
      "id": "imperial",
      "name": "Imperial College London",
      "short_name": "Imperial",
      "group": "UK Core",
      "region": "United Kingdom",
      "accessed_at": "2026-06-26",
      "identity_status": "official_source_listed",
      "requirements_status": "not_collected",
      "programme_count": 248,
      "undergraduate_count": 73,
      "postgraduate_count": 175,
      "programme_id_sha256": "ff124bdf8c1a6fd1c9ed86f6e373adc961fc1548bac22798bf070ef36ea91eb0",
      "source_file": "institutions/imperial.json",
      "migration_source": "imperialPrograms.ts"
    },
    {
      "id": "ucl",
      "name": "UCL",
      "short_name": "UCL",
      "group": "UK Core",
      "region": "United Kingdom",
      "accessed_at": "2026-06-26",
      "identity_status": "official_source_listed",
      "requirements_status": "not_collected",
      "programme_count": 1137,
      "undergraduate_count": 437,
      "postgraduate_count": 700,
      "programme_id_sha256": "f1cbc77fe5063bf118b454b0e689c8740d6b5d5784e8a64345b4d357432fc307",
      "source_file": "institutions/ucl.json",
      "migration_source": "uclPrograms.ts"
    },
    {
      "id": "lse",
      "name": "London School of Economics and Political Science",
      "short_name": "LSE",
      "group": "UK Core",
      "region": "United Kingdom",
      "accessed_at": "2026-06-26",
      "identity_status": "official_source_listed",
      "requirements_status": "not_collected",
      "programme_count": 263,
      "undergraduate_count": 43,
      "postgraduate_count": 220,
      "programme_id_sha256": "c2c1450f1534d70e1cbfb0e64bf406d76945dbdef8d5733dc0a1314dc300bb39",
      "source_file": "institutions/lse.json",
      "migration_source": "lsePrograms.ts"
    },
    {
      "id": "lbs",
      "name": "London Business School",
      "short_name": "LBS",
      "group": "UK Core",
      "region": "United Kingdom",
      "accessed_at": "2026-06-26",
      "identity_status": "official_source_listed",
      "requirements_status": "not_collected",
      "programme_count": 17,
      "undergraduate_count": 0,
      "postgraduate_count": 17,
      "programme_id_sha256": "27a5ee4443d3f7b4530cefc38b1f4e2f86b316c503505b0a14a5d9b022481c68",
      "source_file": "institutions/lbs.json",
      "migration_source": "lbsPrograms.ts"
    },
    {
      "id": "kcl",
      "name": "King's College London",
      "short_name": "KCL",
      "group": "UK Core",
      "region": "United Kingdom",
      "accessed_at": "2026-06-26",
      "identity_status": "official_source_listed",
      "requirements_status": "not_collected",
      "programme_count": 477,
      "undergraduate_count": 152,
      "postgraduate_count": 325,
      "programme_id_sha256": "27197400128ef4763e2bab38350c424f6887699c86df635bf00a822ffb866586",
      "source_file": "institutions/kcl.json",
      "migration_source": "kclPrograms.ts"
    },
    {
      "id": "manchester",
      "name": "The University of Manchester",
      "short_name": "Manchester",
      "group": "UK Core",
      "region": "United Kingdom",
      "accessed_at": "2026-06-26",
      "identity_status": "official_source_listed",
      "requirements_status": "not_collected",
      "programme_count": 934,
      "undergraduate_count": 366,
      "postgraduate_count": 568,
      "programme_id_sha256": "b9746c1e5fe800b48ee62508e9af8f8e1ef1dd4d69e08833b99e1b38f8a4858f",
      "source_file": "institutions/manchester.json",
      "migration_source": "manchesterPrograms.ts"
    },
    {
      "id": "warwick",
      "name": "University of Warwick",
      "short_name": "Warwick",
      "group": "UK Core",
      "region": "United Kingdom",
      "accessed_at": "2026-06-26",
      "identity_status": "official_source_listed",
      "requirements_status": "not_collected",
      "programme_count": 447,
      "undergraduate_count": 189,
      "postgraduate_count": 258,
      "programme_id_sha256": "01df1a981e9cf64fca83210bbec8dd5e00d2a4c2e655b3f0a833d5903231630c",
      "source_file": "institutions/warwick.json",
      "migration_source": "warwickPrograms.ts"
    },
    {
      "id": "edinburgh",
      "name": "The University of Edinburgh",
      "short_name": "Edinburgh",
      "group": "UK Core",
      "region": "United Kingdom",
      "accessed_at": "2026-06-26",
      "identity_status": "official_source_listed",
      "requirements_status": "not_collected",
      "programme_count": 816,
      "undergraduate_count": 349,
      "postgraduate_count": 467,
      "programme_id_sha256": "26e0a4dec7e1ce9b214f0c9286a87d04c2aed0866b8f8019af46857191fce2b2",
      "source_file": "institutions/edinburgh.json",
      "migration_source": "edinburghPrograms.ts"
    },
    {
      "id": "princeton",
      "name": "Princeton University",
      "short_name": "Princeton",
      "group": "US News Top 30",
      "region": "United States",
      "accessed_at": "2026-06-26",
      "identity_status": "official_source_listed",
      "requirements_status": "not_collected",
      "programme_count": 0,
      "undergraduate_count": 0,
      "postgraduate_count": 0,
      "programme_id_sha256": "e3b0c44298fc1c149afbf4c8996fb92427ae41e4649b934ca495991b7852b855",
      "source_file": "institutions/princeton.json",
      "migration_source": "usPrograms.ts"
    },
    {
      "id": "mit",
      "name": "Massachusetts Institute of Technology",
      "short_name": "MIT",
      "group": "US News Top 30",
      "region": "United States",
      "accessed_at": "2026-06-26",
      "identity_status": "official_source_listed",
      "requirements_status": "not_collected",
      "programme_count": 97,
      "undergraduate_count": 58,
      "postgraduate_count": 39,
      "programme_id_sha256": "161d303bf35ba13fafa2b7b91eb2c28f95402fe042cf7ebe5eee32864321ba4f",
      "source_file": "institutions/mit.json",
      "migration_source": "usPrograms.ts"
    },
    {
      "id": "harvard",
      "name": "Harvard University",
      "short_name": "Harvard",
      "group": "US News Top 30",
      "region": "United States",
      "accessed_at": "2026-06-26",
      "identity_status": "official_source_listed",
      "requirements_status": "not_collected",
      "programme_count": 196,
      "undergraduate_count": 62,
      "postgraduate_count": 134,
      "programme_id_sha256": "d5534bbb156f47a7158c9191774bb21032a8d9a5a42ae5bee49e9144a91a92e4",
      "source_file": "institutions/harvard.json",
      "migration_source": "usPrograms.ts"
    },
    {
      "id": "stanford",
      "name": "Stanford University",
      "short_name": "Stanford",
      "group": "US News Top 30",
      "region": "United States",
      "accessed_at": "2026-06-26",
      "identity_status": "official_source_listed",
      "requirements_status": "not_collected",
      "programme_count": 349,
      "undergraduate_count": 151,
      "postgraduate_count": 198,
      "programme_id_sha256": "fb196e244bb1e64223da7d3abdf7042f9f41e65355c9d2464dcc7ecce90b44d0",
      "source_file": "institutions/stanford.json",
      "migration_source": "usPrograms.ts"
    },
    {
      "id": "yale",
      "name": "Yale University",
      "short_name": "Yale",
      "group": "US News Top 30",
      "region": "United States",
      "accessed_at": "2026-06-26",
      "identity_status": "official_source_listed",
      "requirements_status": "not_collected",
      "programme_count": 150,
      "undergraduate_count": 82,
      "postgraduate_count": 68,
      "programme_id_sha256": "c94b00f4c0e4810d55ce5cd9d8d8293709422681a80aee3ff64f826a2996989d",
      "source_file": "institutions/yale.json",
      "migration_source": "usPrograms.ts"
    },
    {
      "id": "uchicago",
      "name": "University of Chicago",
      "short_name": "UChicago",
      "group": "US News Top 30",
      "region": "United States",
      "accessed_at": "2026-06-26",
      "identity_status": "official_source_listed",
      "requirements_status": "not_collected",
      "programme_count": 65,
      "undergraduate_count": 65,
      "postgraduate_count": 0,
      "programme_id_sha256": "9d75910449a61ad09e4a97ece21e592bdf7900b33ac4fcb7864874a0adc06288",
      "source_file": "institutions/uchicago.json",
      "migration_source": "usPrograms.ts"
    },
    {
      "id": "jhu",
      "name": "Johns Hopkins University",
      "short_name": "Johns Hopkins",
      "group": "US News Top 30",